Session ID,Session Start Date,Session End Date,Session Duration,Session Location,Session Talent,Session QA,Session Day,Film ID,Film International Title,Film Original Title,Film Year,Film Duration,Film Directors,Director Biography,Film Synopsis (en),Film Credits (en),Film Genres,Film Sections,Film Categories,Film Awards,Film Types,Film Languages,Film Countries,Film URL
1740-film_session,2024-10-05T10:15:00,2024-10-05T12:03:00,108,Cinema Escorxador,False,True,2024-10-05,6000-film,Night of the Creeps,Night of the Creeps,0,88,Fred Dekker,,,,,Sitges Clàssics,,,Feature film,English,,https://sitgesfilmfestival.com/en/film/2024/night-creeps
1612-film_session,2024-10-05T10:45:00,2024-10-05T12:34:00,109,Sala Auditori Meliá,True,False,2024-10-05,5849-film,Bookworm,Bookworm,2024,104,Ant Timpson,"With a long and diverse career in film, he is known for creating The ABCs of Death saga, producingTurbo Kid(2015) and directingCome to Daddy(2019).","Mildred, a precocious child and avid reader, reconnects with her estranged father, an illusionist in his twilight years, in order to prove the existence of a beast from New Zealand's mythology. Despite the fact that camping is not their thing, together they will embark on great adventures. Elijah Wood stars in an endearing and imaginative comedy with a classic aroma that will delight all Taika Waititi fans.","<strong>Director</strong><br />Ant Timpson&nbsp;<br /><strong>Writer</strong><br />Toby Harvard&nbsp;<br /><strong>Cinematography</strong><br />Daniel Katz&nbsp;<br /><strong>Editor</strong><br />Dan Kircher&nbsp;<br /><strong>With</strong><br />Elijah Wood, Michael Smiley, Nell Fisher&nbsp;",Fiction,Sitges Collection,,,Feature film,English,New Zealand,https://sitgesfilmfestival.com/en/film/2024/bookworm
1767-film_session,2024-10-05T10:45:00,2024-10-05T12:56:00,131,Cinema Casino Prado,True,False,2024-10-05,5887-film,Revolver,Revolver,1973,111,Sergio Sollima,,"The wife of Vito Cipriani, deputy director of a prison in Milan, has been abducted. Her kidnappers get in touch with him to blackmail him: his wife will be killed if young prisoner Milo Ruiz isn't released. A classic poliziesco film, with one of Ennio Morricone's best soundtracks, which delivers an unforgettable and vibrant portrait of male friendship, programmed in collaboration with the San Sebastian Festival.","<strong>Director</strong><br />Sergio Sollima<br /><strong>Writer</strong><br />Sergio Sollima, Dino Maiuri, Massimo De Rita&nbsp;<br /><strong>Cinematography&nbsp;</strong><br />Aldo Scavarda&nbsp;<br /><strong>Editor</strong><br />Sergio Montanari&nbsp;<br /><strong>With</strong><br />Oliver Reed, Fabio Testi, Paola Pitagora&nbsp;",Fiction,Sitges Clàssics,,,Feature film,Italian,Italy,https://sitgesfilmfestival.com/en/film/2024/revolver
1974-film_session,2024-10-05T11:00:00,2024-10-05T12:41:00,101,Sala Llevant,False,False,2024-10-05,6054-film,Generation Terror,Generation Terror,2024,101,,,,,Documentary,Brigadoon; Sitges Documenta,,,Feature film,English; Japanese,United Kingdom of Great Britain and Northern Ireland (the),https://sitgesfilmfestival.com/en/film/2024/generation-terror
2004-film_session,2024-10-05T11:00:00,2024-10-05T12:27:00,87,Sala Tramuntana Meliá,False,False,2024-10-05,6199-film,Ick,Ick,0,87,,,,,,Sitges Collection,,,Feature film,,,https://sitgesfilmfestival.com/en/film/2024/ick
1627-film_session,2024-10-05T12:45:00,2024-10-05T14:37:00,112,Cinema Escorxador,True,False,2024-10-05,5678-film,Dalia & the Red Book,Dalia y el Libro Rojo,2024,107,David Bisbano,Director and screenwriter with a long career in 3D animation production. His feature filmsValentino y el clan del can(2008) andA Mouse Tale( 2012) are two of his outstanding works.,"When Dalia is a little girl, her father includes a character in the novel he's writing as a tribute to her: a goat. Years later, after her father dies leaving the book unfinished, Dalia is kidnapped by the book's main characters, who introduce her into the world of fiction through a portal. The only ally she has there to overcome the challenges she faces is her faithful goat. An adventurous ode to the power of imagination.","<strong>Director</strong><br />David Bisbano&nbsp;<br /><strong>Writer&nbsp;</strong><br />David Bisbano&nbsp;<br /><strong>With</strong><br />Agustina Cirulnik, Mora Kind, Gustavo Barrientos&nbsp;",Fiction,Anima't; Sessió Escoles,,,Feature film,Spanish,Argentina; Spain; Peru; Brazil; Ecuador; Colombia,https://sitgesfilmfestival.com/en/film/2024/dalia-libro-rojo
1720-film_session,2024-10-05T13:00:00,2024-10-05T14:31:00,91,Sala Auditori Meliá,True,False,2024-10-05,5904-film,MadS,MadS,2024,86,David Moreau,French director and screenwriter who embarked on his career alongside Xavier Palud; together they made the New French Extremism classicThem(2006) and the American remake ofThe Eye(2008).,"After trying out a new drug, Romain goes out partying. On the way, he picks up an injured woman on the side of the road, who, when she gets into his car, panics and starts smashing her head until she dies. Thus begins a nightmarish night during which Romain will be unable to tell the difference between what is real and what are the effects of a drug as mysterious as it is powerful.","<strong>Director</strong><br />David Moreau&nbsp;<br /><strong>Writer</strong><br />David Moreau&nbsp;<br /><strong>Cinematography&nbsp;</strong><br />Philip Lozano&nbsp;<br /><strong>With</strong><br />Lewkowski Yovel, Laurie Pavy, Lucille Guillaume",Fiction,Oficial Fantàstic Competició,,,Feature film,French,France,https://sitgesfilmfestival.com/en/film/2024/mads
1840-film_session,2024-10-05T13:00:00,2024-10-05T14:28:00,88,Centre Cultural Miramar,False,False,2024-10-05,6031-film,Captain Avispa,Capitán Avispa,2024,88,"Jean Gabriel Guerra, Jonnathan Melendez",,,,Fiction,Sitges Family - Kids,,,Feature film,Spanish,Dominican Republic (the),https://sitgesfilmfestival.com/en/film/2024/capitan-avispa
1976-film_session,2024-10-05T13:00:00,2024-10-05T14:35:00,95,Sala Llevant,True,False,2024-10-05,6063-film,Mad Props,Mad Props,2023,90,Juan Pablo Reinoso,,"Tom Biolchini, an avid prop collector, embarks on a journey to meet others with the same hobby and, while he's at it, to seek out some of the most coveted pieces in the history of film.",,Documentary,Brigadoon; Sitges Documenta,,,,English,United States of America (the),https://sitgesfilmfestival.com/en/film/2024/mad-props
1827-film_session,2024-10-05T13:00:00,2024-10-05T14:52:00,112,Sala Tramuntana Meliá,True,False,2024-10-05,5936-film,A Fishermen’s Tale,Un Cuento de Pescadores,2024,103,Edgar Nito,,"Popular wisdom has it that years ago, nature thrived in harmony around Lake Patzcuaro and its islands, until evil arrived. Men, blinded by dark desires, brought fear, hatred and death. The fishermen call her 'La Miringua', the one who drags you down and drowns you in the lake for your sins. A dark reimagining of a legend from the rural folklore of the Mexican state of Michoac&aacute;n.","<strong>Director</strong><br />Edgar Nito<br /><strong>Writer</strong><br />Edgar Nito, Alfredo Mendoza<br /><strong>Cinematography</strong><br />Juan Pablo Ramirez&nbsp;<br /><strong>Editor</strong><br />Sam Baixauli, Cruz Mart&iacute;nez&nbsp;<br /><strong>With</strong><br />Jorge A Jim&eacute;nez, Renata Vaca, No&eacute; Hern&aacute;ndez",Fiction,Noves Visions,,,Feature film,Spanish; Purepecha,Mexico,https://sitgesfilmfestival.com/en/film/2024/cuento-pescadores
1603-film_session,2024-10-05T15:00:00,2024-10-05T18:36:00,216,Cinema Escorxador,True,True,2024-10-05,5804-film,Alien 2,Alien 2: Sulla terra,1980,82,,,"Following a space shuttle accident, some strange blue crystals fall to Earth. Parallel to this event, a group of speleologists venture into a series of caves dating back to the dawn of time to explore them, an inhospitable place where the alien crystals will mutate into a bloody monster. A hilarious and brilliant Italian faux sequel to<em> Alien</em>, which in turn served as the inspiration for <em>The Descent.</em>","<strong>Director</strong><br />Ciro Ippolito<br /><strong>Writer</strong><br />Ciro Ippolito<br /><strong>Cinematography</strong><br />Silvio Fraschetti<br /><strong>Editor</strong><br />Carlo Broglio<br /><strong>With</strong><br />Belinda Mayne, Mark Bodin, Roberto Barrese",Fiction,Sitges Clàssics,,,Feature film,Spanish,Italy,https://sitgesfilmfestival.com/en/film/2024/alien-2
1603-film_session,2024-10-05T15:00:00,2024-10-05T18:36:00,216,Cinema Escorxador,True,True,2024-10-05,6019-film,Beyond the Door / The Devil Within Her,Beyond the Door,1974,108,,,"Jessica Barrett, wife and mother of two young children, starts to show signs of a demonic possession while pregnant with her third child. As she seeks help from her husband and her physician, a mysterious man reaches out to her. We celebrate the 50th anniversary of one of the most deliriously festive exploits of The Exorcist from the 1970s with a restored copy courtesy of Ovid G. Assonitis, the film's producer, director and screenwriter.","<strong>Director</strong><br />Ovidio G. Assonitis, Roberto D'Ettorre Piazzoli<br /><strong>Writer</strong><br />Ovidio G. Assonitis, Roberto D'Ettorre Piazzoli, Antonio Troiso<br /><strong>Cinematography</strong><br />Roberto D'Ettorre Piazzoli&nbsp;<br /><strong>Editor</strong><br />Angelo Curi &nbsp;<br /><strong>With</strong><br />Juliet Mills, Gabriele Lavia, Richard Johnson",Fiction,Sitges Clàssics,,,Feature film,English,United States of America (the); Italy,https://sitgesfilmfestival.com/en/film/2024/beyond-door
1776-film_session,2024-10-05T15:30:00,2024-10-05T17:13:00,103,Sala Tramuntana Meliá,False,False,2024-10-05,5711-film,Schirkoa: In Lies We Trust,Schirkoa: In Lies We Trust,2024,103,Ishan Shukla,"His short filmSchirkoa(2016), now adapted to feature film format, won multiple awards. In 2023, he directed and wrote an episode of theStar Wars: Visionsseries.","An Orwellian nightmare with aesthetics characteristic of a video game, this film is set in a gray and oppressive city, where all its citizens hide their faces behind paper bags and a name made up of a sequence of numbers. Among them, a bored office worker, who will be accidentally swept into the center of a revolution launched by those on the fringes of society.","<strong>Director</strong><br />Ishan Shukla<br /><strong>Writer</strong><br />Ishan Shukla<br /><strong>With</strong><br />Golshifteh Farahani, Asia Argento, Gaspar No&eacute;&nbsp;",,Noves Visions,,,Feature film,English; French; Japanese; Invented Language,India; France; Germany,https://sitgesfilmfestival.com/en/film/2024/schirkoa-lies-we-trust
1954-film_session,2024-10-05T16:00:00,2024-10-05T17:36:00,96,Sala Llevant,False,False,2024-10-05,6061-film,Luca il contrabbandiere,Luca il contrabbandiere,1980,96,Lucio Fulci,,Luca makes a living running port smuggling operations for the Neapolitan mafia. Everything gets complicated when he reveals their activity to the police.,,,Brigadoon,,,Feature film,Italian,Italy,https://sitgesfilmfestival.com/en/film/2024/luca-il-contrabbandiere
1768-film_session,2024-10-05T16:15:00,2024-10-05T17:57:00,102,Cinema Casino Prado,False,False,2024-10-05,6039-film,Robot Salvaje,The Wild Robot,2024,102,Chris Sanders,,"From DreamWorks Animation, an exciting adventure now arrives at the Festival featuring Roz, voiced by Lupita Nyong'o, a robot shipwrecked on a deserted island. In addition to surviving in a harsh environment, Roz comes into contact with the friendly local wildlife, even becoming the adoptive mother of an orphaned baby goose. This adaptation of Peter Brown's books of the same name will captivate all Hayao Miyazaki fans with its lush atmosphere.","<strong>Director</strong><br />Chris Sanders<br /><strong>Writer</strong><br />Chris Sanders<br /><strong>Cinematography</strong><br />Chris Stover<br /><strong>Editor</strong><br />Mary Blee<br /><strong>With</strong><br />Lupita Nyong&rsquo;o, Pedro Pascal, Catherine O&rsquo;Hara",Fiction,Sitges Collection - Sessió Especial,,,Feature film,English,United States of America (the),https://sitgesfilmfestival.com/en/film/2024/robot-salvaje
1928-film_session,2024-10-05T17:00:00,2024-10-05T18:26:00,86,Centre Cultural Miramar,False,False,2024-10-05,5837-film,John Vardar vs the Galaxy,Jon Vardar protiv Galaksijata,2024,86,Goce Cvetanovski,,,,Fiction,Sitges Family - Kids,,,Feature film,Macedonian,North Macedonia; Hungary; Bulgaria; Croatia,https://sitgesfilmfestival.com/en/film/2024/john-vardar-vs-galaxy
1678-film_session,2024-10-05T17:15:00,2024-10-05T17:35:00,20,Sala Auditori Meliá,True,False,2024-10-05,5997-film,Get Away,Get Away,0,0,Steffen Haars,,,,,Oficial Fantàstic Competició,,,Feature film,,,https://sitgesfilmfestival.com/en/film/2024/get-away
1884-film_session,2024-10-05T18:15:00,2024-10-05T19:54:00,99,Sala Tramuntana Meliá,False,False,2024-10-05,5683-film,Escape From the 21st Century,Escape From the 21st Century,0,98,Li Yang,,,,,Oficial Fantàstic Competició,,,Feature film,Chinese,,https://sitgesfilmfestival.com/en/film/2024/escape-21st-century
1998-film_session,2024-10-05T18:30:00,2024-10-05T20:20:00,110,Cinema Casino Prado,True,False,2024-10-05,5987-film,Centaurs of the night,Centaures de la nit,2024,105,Marc Recha,,,,Fiction,Noves Visions,,,Feature film,Catalan; Slovenian; Italian,Spain,https://sitgesfilmfestival.com/en/film/2024/centaures-nit
1757-film_session,2024-10-05T19:00:00,2024-10-05T20:36:00,96,Cinema Escorxador,True,False,2024-10-05,6210-film,A Nightmare on Elm Street (1984) Pesadilla en Elm Street,A Nightmare on Elm Street,1984,91,Wes Craven,,,,Fiction,Sitges Clàssics,,,Feature film,English,United States of America (the),https://sitgesfilmfestival.com/en/film/2024/pesadilla-elm-street-nightmare-on-elm-street
1988-film_session,2024-10-05T19:00:00,2024-10-05T20:56:00,116,Centre Cultural Miramar,False,False,2024-10-05,6089-film,The Worlds Divide,The Worlds Divide,2024,116,Denver Jackson,,,,Fiction,Sitges Family - Kids,,,Feature film,English,Canada,https://sitgesfilmfestival.com/en/film/2024/worlds-divide
1569-film_session,2024-10-05T19:30:00,2024-10-05T22:04:00,154,Sala Auditori Meliá,True,False,2024-10-05,5909-film,Exhuma,Pa-Myo,2024,134,Jae-Hyun Jang,"Korean filmmaker who debuted in 2015 withThe Priest, a major box office sensation in his native country.Exhumais his third film as director.","Famous shaman Hwa-rim and her prot&eacute;g&eacute; Bong-gil receive a large sum of money to meet with the descendants of a family afflicted by a peculiar disease and discuss their funeral rites. Sensing the sinister aura surrounding the family niche, Hwa-rim proposes that the grave should be relocated, setting off a dangerous chain of supernatural events. High-quality Korean horror with Choi Min-sik (<em>Old Boy</em>) in one of the leading roles.","<strong>Director</strong><br />Jang Jae-hyun<br /><strong>Writer</strong><br />Jang Jae-hyun&nbsp;<br /><strong>Cinematography</strong><br />Lee Mo-gae<br /><strong>Editor</strong><br />Jeong Byeong-jin<br /><strong>With</strong><br />Lee Do-hyun, Kim Go-eun, Choi Min-sik",Fiction,Oficial Fantàstic Competició,,,Feature film,Korean,Korea (the Republic of),https://sitgesfilmfestival.com/en/film/2024/exhuma
1786-film_session,2024-10-05T20:30:00,2024-10-05T22:12:00,102,Sala Tramuntana Meliá,False,False,2024-10-05,5816-film,Steppenwolf,Steppenwolf,2023,102,Adilkhan Yerzhanov,,"Tamara searches for her missing son in a small town consumed by unrest and violence. In a desperate attempt to recover him, she decides to offer a reward to an amoral investigator whose methods prove to be very sadistic. Determined to go the distance, Tamara decides to complete the search no matter what it takes, and she will do it with the violent detective. A surprising Kazakh neo-western with echoes of <em>No Country for Old Men</em>.&nbsp;","<strong>Director</strong>&nbsp;<br />Adilkhan Yerzhanov&nbsp;<br /><strong>Writer</strong><br />Adilkhan Yerzhanov&nbsp;<br /><strong>Cinematography&nbsp;</strong><br />Yerkіnbek Ptyraliyev&nbsp;<br /><strong>Editor</strong><br />Arif Tleuzhanov, Adilkhan Yerzhanov&nbsp;<br /><strong>With</strong><br />Berіk Aitzhanov, Anna Starchenko, Azamat Nigmanov&nbsp;",Fiction,Òrbita,,,Feature film,Kazakh,Kazakhstan,https://sitgesfilmfestival.com/en/film/2024/steppenwolf
1708-film_session,2024-10-05T20:45:00,2024-10-05T23:10:00,145,Cinema Casino Prado,True,False,2024-10-05,5890-film,La sustancia (The Substance),La sustancia (The Substance),2024,140,,,,,Fiction,Sitges Collection,,,Feature film,English,United Kingdom of Great Britain and Northern Ireland (the),https://sitgesfilmfestival.com/en/film/2024/sustancia-substance
1890-film_session,2024-10-05T21:00:00,2024-10-05T22:39:00,99,Sala Llevant,False,False,2024-10-05,6066-film,Monster on a plane,Monster on a plane,2024,99,Ezra Tsegaye,,"On board a plane, a mysterious creature from faraway lands wakes up and starts attacking the passengers. As if that weren't enough, a ruthless killer is also hiding among them.",,,Brigadoon,,,Feature film,English,Germany,https://sitgesfilmfestival.com/en/film/2024/monster-on-plane
1751-film_session,2024-10-05T21:00:00,2024-10-05T22:44:00,104,Cinema Escorxador,True,False,2024-10-05,5732-film,Oddity,Oddity,2023,99,Damian  Mc Carthy,"Award-winning short film director who in 2020 made a name for himself internationally withCaveat, his debut feature-length horror film.","A year after her twin sister is brutally murdered on a remote rural estate, Darcy, a self-proclaimed psychic and curio collector, pays an unexpected visit to her brother-in-law and his new girlfriend. Darcy senses that her sister's death hides some sort of secret, and she is determined to uncover the sinister truth in the company of a macabre wooden doll.","<strong>Director</strong> <br />Damian McCarthy  <br /><strong>Writer</strong> <br />Damian McCarthy  <br /><strong>Cinematography</strong> <br />Colm Hogan  <br /><strong>Editor</strong> <br />Brian Philip Davis  <br /><strong>With</strong> <br />Gwilym Lee, Carolyn Bracken, Tadhg Murphy",Fiction,Panorama,,,Feature film,English,Ireland,https://sitgesfilmfestival.com/en/film/2024/oddity
1594-film_session,2024-10-05T22:30:00,2024-10-06T00:27:00,117,Sala Auditori Meliá,True,False,2024-10-05,6169-film,Apocalypse Z: The Beginning of the End,Apocalipsis Z: El principio del fin,2023,112,Carles Torrens,,,,Fiction,Sitges Collection,,,Feature film,Spanish,Spain,https://sitgesfilmfestival.com/en/film/2024/apocalipsis-z-principio-fin
1600-film_session,2024-10-05T22:45:00,2024-10-06T00:21:00,96,Sala Tramuntana Meliá,False,False,2024-10-05,5740-film,Basileia,Basileia,2024,96,Isabella Torre,"Italian filmmaker, writer and actress. In 2018, she wrote, directed and starred in her first short film,Nymphs, which premiered at the Venice Film Festival.","In the rugged, mist-shrouded Italian mountains of the Aspromonte in the Calabria region, a ruthless archaeologist and his assistants are searching for an ancient treasure. However, their excavations will unleash some mysterious mythological creatures that will permanently change the lives of all the inhabitants of this remote rural area. A fascinating and peculiar new twist on the folk horror subgenre.","<strong>Director</strong><br />Isabella Torre<br /><strong>Writer</strong><br />Isabella Torre&nbsp;<br /><strong>Cinematography</strong>&nbsp;<br />M&eacute;lanie Akoka<br /><strong>Editor</strong><br />Jonas Carpignano&nbsp;<br /><strong>With</strong><br />Elliott Crosset Hove, Angela Fontana, Koudous Seihon",Fiction,Oficial Fantàstic Competició,,,Feature film,Italian; English; Danish,Italy; Sweden,https://sitgesfilmfestival.com/en/film/2024/basileia
1889-film_session,2024-10-05T23:00:00,2024-10-06T00:22:00,82,Sala Llevant,False,False,2024-10-05,6064-film,Marisa y Gomoso,Marisa y Gomoso,2023,82,Pablo Parés,,"Marisa, the star of the children's show Marisa y Gomoso est&aacute;n de fiesta, separates from her long-time partner and returns to her childhood neighborhood. After reuniting with Gomoso, she will try to adapt to her new life in the suburbs of Buenos Aires.",,,Brigadoon,,,Feature film,Spanish,Argentina,https://sitgesfilmfestival.com/en/film/2024/marisa-gomoso
1752-film_session,2024-10-05T23:15:00,2024-10-06T01:19:00,124,Cinema Escorxador,True,False,2024-10-05,6115-film,Párvulos,Párvulos,2024,119,Isaac Ezban,"A Mexican screenwriter and director. His debut feature, The Incident (2014), was selected at Cannes. His second film, The Similars, picked up the Blood Window Award at Sitges 2015.","Three brothers struggle to survive in a secluded country house after their parents leave, never to return. Little by little, we begin to perceive strange details, signs that the world as we know it has undergone some sort of terrible metamorphosis. The worst of it all is in their basement, where the boys hide a sinister secret. A unique coming-of-age movie with a tone that swings between a dark fairy tale and the most sordid apocalyptic cinema.","<strong>Director</strong><br />Isaac Ezban<br /><strong>Writer</strong><br />Isaac Ezban, Ricardo Aguado-Fentanes<br /><strong>Cinematography</strong><br />Rodrigo Sandoval<br /><strong>Editor</strong><br />Oscar Figueroa<br /><strong>With</strong><br />F&eacute;lix Farid Escalante, Leonardo Cervantes, Mateo Ortega",Fiction,Panorama,,,Feature film,Spanish,Mexico,https://sitgesfilmfestival.com/en/film/2024/parvulos
1622-film_session,2024-10-05T23:30:00,2024-10-06T00:51:00,81,Cinema Casino Prado,True,False,2024-10-05,5675-film,Confession,Kokuhaku,2024,76,Nobuhiro Yamashita,"Award-winning Japanese director and screenwriter known for films likeLinda Linda Linda(2005),La La La at Rock Bottom(2015) andLet’s Go Karaoke!(2023).","Two mountain climbing friends, Asai and Ryu Ji-Yeong, are trapped in the middle of a storm following an accident. Ryu Ji-Yeong, seriously believing that they are close to death, decides to reveal a secret and confesses to a heinous murder he committed as a teenager. However, the two mountaineers survive, and the relationship between them will gradually become strained as they wait to be rescued.","<strong>Director</strong><br />Nobuhiro Yamashita&nbsp;<br /><strong>Writer</strong><br />Shuji Yuki, Ryo Takada&nbsp;<br /><strong>Cinematography</strong><br />Shinya Kimura&nbsp;<br /><strong>Editor</strong><br />Daisuke Imai&nbsp;<br /><strong>With</strong><br />Toma Ikuta, Yang Ik-june, Nao",Fiction,Òrbita,,,Feature film,Japanese; Korean,Japan,https://sitgesfilmfestival.com/en/film/2024/confession
1702-film_session,2024-10-06T01:00:00,2024-10-06T05:43:00,283,Sala Auditori Meliá,True,False,2024-10-06,5690-film,Krazy House,Krazy House,2024,87,Steffen Haars,Dutch directing duo known for their unbridled humor and outbursts of violence. Their best known work is the diptych formed by NewKids Turbo (2010) and New Kids Nitro (2011).,"Bernie is an extremely devout religious man and family man living in a 1990s American sitcom. However, his fun and idyllic family life is cut short by the appearance of a group of three Russian workers who are actually criminals wanted by the police. The directors of <em>New Kids Turbo</em> are back with a wild comedy featuring a cast headed by Nick Frost and Alicia Silverstone.","<strong>Director</strong><br />Steffen Haars, Flip Van der Kuil&nbsp;<br /><strong>Writer</strong><br />Steffen Haars, Flip Van der Kuil&nbsp;<br /><strong>Cinematography</strong><br />Joris Kerbosch	&nbsp;<br /><strong>Editor</strong><br />Ren&eacute; van Berge Henegouwen, Flip Van der Kuil&nbsp;<br /><strong>With</strong><br />Nick Frost, Alicia Silverstone, Kevin Connolly&nbsp;",Fiction,Midnight X-Treme,,,Feature film,English; Russian,Netherlands (the),https://sitgesfilmfestival.com/en/film/2024/krazy-house
1702-film_session,2024-10-06T01:00:00,2024-10-06T05:43:00,283,Sala Auditori Meliá,True,False,2024-10-06,6114-film,Jimmy & Stiggs,Jimmy & Stiggs,2024,80,Joe Begos,"He made his first film, Almost Human, in the winter of 2012 in his home state of Rhode Island, and has been making feature films ever since.","Jimmy Lang, a totally out-of-control horror movie director, has become a drug addict who lives as a homebound recluse. On one of his regular nights out partying, Jimmy is visited by a group of violent extraterrestrials. After making a decision to take on the aliens, he calls Stiggs, his best friend, looking for help. Joe Begos returns to Sitges with a lysergic, punk horror and sci-fi party starring none other than himself.","<strong>Director</strong><br />Joe Begos<br /><strong>Writer</strong><br />Joe Begos<br /><strong>Cinematography</strong><br />Brian Sowell, Mike Testin<br /><strong>Editor</strong><br />Josh Ethier<br /><strong>With</strong><br />Joe Begos, Matt Mercer, James Russo",Fiction,Midnight X-Treme,,,Feature film,English,United States of America (the),https://sitgesfilmfestival.com/en/film/2024/jimmy-stiggs
1702-film_session,2024-10-06T01:00:00,2024-10-06T05:43:00,283,Sala Auditori Meliá,True,False,2024-10-06,6180-film,Plastic Guns,Les Pistolets en Plastique,2024,95,Jean-Christophe Meurisse,,,,Fiction,Midnight X-Treme,,,Feature film,French,France,https://sitgesfilmfestival.com/en/film/2024/plastic-guns
